{
  "$schema": "http://json-schema.org/draft-07/schema#",
  "title": "Proof Harness Schema",
  "description": "Schema for validator proof files generated by ProofHarness",
  "type": "object",
  "required": [
    "version",
    "validator",
    "timestamp",
    "total_cases",
    "passed_valid",
    "rejected_invalid",
    "false_negatives",
    "false_positives",
    "contract_hash",
    "signature"
  ],
  "properties": {
    "version": {
      "type": "string",
      "pattern": "^\\d+\\.\\d+\\.\\d+$"
    },
    "validator": {
      "type": "string",
      "minLength": 1
    },
    "timestamp": {
      "type": "string",
      "pattern": "^\\d{4}-\\d{2}-\\d{2}T\\d{2}:\\d{2}:\\d{2}\\.\\d{3}Z$"
    },
    "total_cases": {
      "type": "integer",
      "minimum": 0
    },
    "passed_valid": {
      "type": "integer",
      "minimum": 0
    },
    "rejected_invalid": {
      "type": "integer",
      "minimum": 0
    },
    "false_negatives": {
      "type": "integer",
      "const": 0,
      "description": "Must be exactly 0 for valid proof"
    },
    "false_positives": {
      "type": "integer",
      "const": 0,
      "description": "Must be exactly 0 for valid proof"
    },
    "contract_hash": {
      "type": "string",
      "pattern": "^[a-f0-9]{64}$",
      "description": "SHA256 hash of the validator contract file"
    },
    "signature": {
      "type": "string",
      "pattern": "^[a-f0-9]{64}$",
      "description": "SHA256 signature of proof payload (validator + testResults)"
    }
  },
  "additionalProperties": false
}
