{
  "version": "1.0.0",
  "validator": "json_validator",
  "timestamp": "2026-03-30T14:00:11.113Z",
  "total_cases": 300,
  "passed_valid": 150,
  "rejected_invalid": 150,
  "false_negatives": 0,
  "false_positives": 0,
  "contract_hash": "91120fb6942a15284ca3ac9d16c5788283217d905f2e7c25a3d8f8b9459e805d",
  "signature": "a44fafd908c2202633e3efb8981c92b06c23b0963f272f240015473724b9fb99"
}