{
  "version": "1.0.0",
  "validator": "config_validator",
  "timestamp": "2026-03-26T20:47:18.888Z",
  "total_cases": 250,
  "passed_valid": 100,
  "rejected_invalid": 150,
  "false_negatives": 0,
  "false_positives": 0,
  "contract_hash": "1dfb97131df8e3ac048048680ef8c7c464e44f8c740b3c66262be9e0eb0d6fa7",
  "signature": "bdb3cb240389024bb44406ad266a01a2fd6b23f46a5e3fb8add6c95139303956"
}